1706920451.0,123,Has anybody played with Astrological sign as a feature?,"Now that I've got your attention.

Astrology, while largely a pseudoscience that appeals to non data minded folk, is largely about identifying trends and presenting them in a human readable (albeit unscientific) format.

While it's unlikely that the placement of the stars and planets themselves have a significant impact on the trajectory of an individual, the placing of their birthdate within the year (which I suppose is in relation to the sun) probably has an impact on how they develop and find their way within society.

For example, someone born in August tends to start school almost a year earlier in their development than an individual born in September. From there the August child will always be amongst the youngest in their class whereas the September child is grouped with the oldest. This has cascading effects throughout childhood development that will leave drastically different imprints upon both children and create different adult life paths.

So now that I've gone through that long winded explanation to justify my buzzy title, does anybody have experience playing with birthdate (specifically time of year, as opposed to age) as a feature?","This is something that comes up in sports because of the way youth leagues are sometimes run. Typically kids will be grouped by age with an annual cutoff date. Those with birthdays soon after the cutoff are at an advantage, because they will be among the oldest in their age group, and therefore the largest. This feeds into a cycle of the most successful kids getting the most attention and coaching. This ultimately leads to a selection bias within pro sports based on birthdate.

Here's a reddit thread that shows the distribution of NHL Hockey players based on month of birth: https://www.reddit.com/r/hockey/comments/il72c1/birth\_month\_of\_nhl\_players\_born\_since\_1980/","20 years ago one of my first bosses always made us put star sign into the model building mix. 

It would occasionally be significant, and the lesson he was trying to teach was that domain knowledge and model explainability were important (at least in our domain) because occasionally random noise was significant enough to be selected by the model algorithms. 

Great guy, learned a lot from him.","> For example, someone bon in August tends to start school almost a year earlier in their development than an individual born in September.

This impact is profound.  Others have talked about sports (birthdates for Little League eligibility on MLB players birthdays, also Canadian junior league hockey.  

The decision to delay kindergarten by a year is a strategy used by a lot of students.  The theory is that the additional maturity in the child leads to long-term better performance and confidence.  

There is a lot of economic and social science research in these areas.  If you are doing anything in that area, or related fields (education, psychology...) it's worth considering as a variable."
1708122423.0,119,Why did you choose data science vs. some other software engineering/development discipline?,"There was a post on this about an hour ago. I thought this was a great question for a Friday, but sadly OP deleted the original post. 

So why did you choose data science over software engineering?","Having tried both, I found I liked doing statistics, visualizing data, writing up insights, et cetera, a lot more than I liked the process of coding systems. Programming felt like something I enjoyed when I was very invested in the end product, which is great as a hobby but not great for a career. For data science, I've worked on things that I didn't give a shit about but I still enjoyed the work - which makes it a good thing to build a career on :)","Because I’m good at math but a poor software engineer, and this seemed like a reasonably easy path to high salaries. Pretty simple, lol","It's easier to teach a PhD scientist how to code ""well enough"" for Data Science than it is to learn how to be a software engineer. And for people who state with absolute fact that you need to be a software engineer to be a data scientist, I encourage you to look outside of big tech companies and high tech startups.

Also being a Sr. Engineer in production is shit. Everything is on fire all of the time constantly, the pay is pretty mediocre for how much stress you're under, the operators are there to put in their 8 hours and go home, being on call sucks, and the commute was terrible for me. I didn't want to do basically the same thing but on a computer instead of with coating chambers."
1707191539.0,121,Analyzing datasets with trillions of records?,"Read a job posting with a biotech firm that's looking for candidates with experience manipulating data with **trillions** of records.

I can't fathom working with datasets that big. Depending on the number of variables, would think it'd be more convenient to draw a random sample?",You don’t analyze it all at once. Just working with data that big is hard and involves tons of engineering. Take a look at Databricks,"This is coming from a data modelling/DE point of view, but you could pretty easily have a trillion+ rows in partitioned tables with large number of groups and observations (e.g., 20-30 years of daily data). I doubt anyone would try to `SELECT *` it into a dataframe, though.

A real-world example: We create a performance table (my domain is finance) that, if allowed to, would grow to tens of trillions of rows. Simply a matter of creating enough scenarios that are allowed to map many-to-many when it comes to measurement periods (i.e., start on Jan 1st., stop at Jan 2nd, and stop at Jan 3rd. etc., with different calculations for each).

You will almost always pick a couple partitions to pull data from. So, while the ""core table"" is huge, the workspace remains easy to manage.","Data this large can crop up in lots of places: logs or telemetry data from big distributed systems, sensor data from the hard sciences, bioinformatics stuff, etc. 

You’re right that it’s often more effective to draw random sample than deal with the whole enchilada at once. But oftentimes depending on the problem space it’s nontrivial figuring out when and how to draw those samples so as to leverage the data properly/effectively; hence data scientists. 

The general pattern of solving business problems with data this large is mostly the same, it just is more complicated and relies on more high-powered tooling (e.g. data sitting compressed columnar formats in cloud storage, big compute clusters for analyzing that data, aggregating it and depositing the downsampled forms it somewhere else, etc). 

Source: I dealt with datasets of this size for several years as an applied researcher at AWS."
1706527632.0,125,Which path is better: Data Science or Software Engineering?,"Okay, so I'm in need of some career advice, because honestly I'm at a point where I don't really know how to proceed in the future.

For some background info:
- I've completed my Bachelor's degree in Computer Science (3 years degree), took a year of pause (during that time I just focused on work), and at the moment I'm in my first year (out of 2) of my Masters's degree in Data Science.

- As for work experience, I started working during my second year of Bachelor's as a Software Engineer. I've completed two internships, and I've been a Junior Software Engineer for more than a year and a half (currently I'm still working, trying to manage both my job and the university lectures and assignments in parallel). The languages/frameworks that I've worked with the most are Python - Django/FatsAPI, Ruby - Ruby on Rails, TypeScript - React (even if my perspective for this field is that I shouldn't be fixed on just some languages/standards, as the industry is evolving at such a rate, that from a month to the other we might find a new tool that's 100 times more efficient).

- Up until recently I didn't ever interact that much with the concepts of Machine Learning, but since starting the Data Science degree I've realised that I like this field a lot and I take every Uni project as a challenge that I love solving.

Now let's get to the actual issue at hand: in the next few months I would like to look for another workplace, since I've realized that the environment that I'm currently in is affecting me negatively and unfortunately I don't consider that this is a place where I can grow (both as an employee/software engineer as well as a person in general). If you'd like more info about the reasons, I can edit this post and add them, but I don't want to make this too long.

At this point, I don't really know what path to take: continue with the Software Engineering career or switch to Data Science / ML / NLP?

I'm asking this from 2 distinct perspectives:
1. which one of the two is better for my future? I've been reading different posts lately about some data scientists / ml engineers saying that this field is really volatile and a lot of companies switch strategies from one day to another and many find themselves unemployed out of the blue, besides the fact that some people say that there are already too many data scientists / ml engineers for the few jobs required. But thinking about all of the advances in AI that have been happening lately, I was under the impression that this field is going to thrive in the future.
2. I have always believed that salaries in both fields are good, but as a data scientist / ml engineer you can reach a higher max salary compared to what the max salary of a software engineer can be (even if I've also read posts that stated the contrary).

If I want to be completely honest, I think that I already have the answer, since I like a lot what I'm studying and everything related to this field is just sooo captivating. 

But my problem right now is that I've ve been able to get to a point where I'm competent enough as a software engineer to make enough money to support myself, so finding another job in the same field would be easier. Since my parents are not helping me financially anymore, I don't think I would be able to get by with the paycheck of an intern (around 800 Euros/month where I live), if I were to switch fields.
And I don't think anyone would take me in this field for anything more than an internship, because I'm aware of the fact that I do not have enough experience in Machine Learning and Statistics for any other role.

As for some additional information that might be helpful, I'm in my early twenties and I live in Eastern Europe, where prices are not as high as in other places, but it's still not easy to get by by yourself.
I've been also looking around for various opportunities in other countries in this field, in order to be able to work remotely or maybe do an internship there, but I haven't been able to find much.

PS: I know that a lot of people might say that I'm young and that this is the best time to take risks, but going to an intern's salary would just expose me to the risk of being homeless, and that's not such a good option :D

PS 2.0: I have also mentioned the NLP sector because it sparked my interest and I’ve been taking some extra classes in order to gain some more knowledge about it.

TLDR: which is the best career option between Software Engineering and Data Science/ML/NLP?","Become a Software Engineer, it is definitely more stable and you'll have more breath room with what you want to work on or who you want to work with.","just my 2 cents from my boss re: data science. choose one of two: 

1. heavy prob/stats with deep math knowledge. 
2. basically dev with DS knowledge. be able to fully deploy ML models from start to finish. 

anyone in between (fit-transform/notebook ds) are getting shaken out of the market.",[deleted]
1709168601.0,121,Analysts with Weird Degrees: What is it?,"I have a degree in the Arts field. Have been successful in this field and peaked at where I am (mid 30s). Looking to make use of self-taught programming, Tableau, analytics, etc. to get another job/career start. 

If you were in a similar spot with an unrelated degree and unrelated previous career, what was it? Did you manage to find some work in data? 

Would love to hear your story for some inspiration.","I’m a Director now, but English Literature.

I worked in the business side of an insurance company doing underwriting and claims and then went back to grad school. Wrote what must have been one heck of an admissions essay. All I remember is that my Mom said it was overdone and I should reconsider. It’s literally the only criticism my Mom has made of my writing (no hard feelings, just stands out). 

When I got to grad school I realized that I had taken 2 math courses in the past 7 years and failed one of them (pre-calculus). So I took a totally different approach. I rewrote every variable, equation and notation into actual words, like a sentence. It totally changed how I saw math and dovetailed nicely with learning to program. 

Did really well in the program, finished very quickly and then did the consulting firm thing. Went back into insurance on the data side and it’s worked out well so far. 

For scale, this journey from English Major to Director of Data Science took 15 years.","Some of the best analysts I've seen in my career came from  non technical backgrounds.  Coding isn't even half the equation.

Understand the business you're supporting, communicate well, listen critically, ensure the right questions are being asked, and above all have an insatiable curiosity.

Edit:  I have a bachelor's degree in Marketing and I'm now a Director of Analytics.","Masters in Supply chain management and bachelors of business. I had 1 semester of R in undergrad and I liked to do stuff in Excel. I taught myself Tableau and used that and excel skills to talk my way into an analyst job that required Power BI. Spent a bunch of time on YouTube and taught myself Power BI. Quickly hit a limit with Excel and Power BI and broke out my notes from R. Now I do lower level Data science and ML all the time to solve business problems and spend most of my day coding in R. In those 3 years I have also increased salary from 65k to 90k because of those DS skills I've turned into business insights. Stay humble and always be learning but when you deliver something cool, be sure to sell it"
1704212735.0,120,Meeting hate - is this common?,"I like everything about being a Data Scientist except the meetings. Research is my favorite part, both the heads down modeling and the paper reading. Coding is alright. Even bug fixing is tolerable, kind of scary at first, each time, but then really rewarding when you fix the bug. Meeting prep, like making slides and organizing my thoughts, is fun. But the meetings themselves… just suck. I have a color coded spreadsheet each week showing the times of my meetings, colored by how much they’re going to suck.

Last minute ad hoc meetings that are unnecessary are awful. Meetings where some other DS or Eng or even business query monkey shares their screen and I watch them work are the absolute worst. Working from home saves me because I can decompress after each meeting. But even when I worked in the office, I loved the work and hated the meetings.

Just wondering if others feel the same.",[deleted],"> I have a color coded spreadsheet each week showing the times of my meetings, colored by how much they’re going to suck.

Are you sure you're not over-fixating on this? Because generating a spreadsheet just to quantify how much you dislike a key component of your job, communication, sure seems like over-fixating to me. Almost every job has some tedious component, and the good thing about meetings is that there are concrete steps that can be taken to improve everyone's experience (setting agendas, goals, follow-ups).",“Business query monkey” you sound like a lovely person to work with.
1708473395.0,113,Thinking like a Data Scientist in my job search. Making this tool public.,"I got tired of reading job descriptions and searching for the keywords ""python"", ""data"" and ""pytorch"". So I made this notebook which can take just about any job board and a few CSS selectors and spits out a ranking far better than what the big aggregators can do. Maybe someone else will find it useful or want to collaborate? I'm deciding to take this minimal example public. Maybe it has commercial viability? Maybe someone here knows?

&#x200B;

[Colab notebook](https://colab.research.google.com/gist/gbwiersum/b112a6534d71d8ae3c360f5a160cc1dc/job-board-scrapenscore.ipynb)

&#x200B;

It's also a demonstration of comparing arbitrarily long documents with true AI. I thought that was cool.

If you reaaaaly like it, maybe hire me? ",That's really cool! Your last line hits too close to home.,Cool app. Would make a nice platform if you could aggregate everything in a web app rather than notebook,That's really smart. Best of luck in your job search!
1704363731.0,117,How do you detect when a data scientist is chasing a wild goose? And how do you prevent them from consuming company resouces unnecessarily?,"Some teams in my organization have empowered data scientists to explore and develop AI/ML use cases, which is a positive initiative, in the sense that data scientistsare now encouraged to engage more with cross functional data. However, we have noticed that this freedom has led to an experimentation spree, resulting in unnecessary expenses and resource allocation. The new data scientists, who joined our org after getting impacted by FAANG layoffs, are insisting on expensive software and cloud technologies that are straining our annual budget. 

This has caused some concern among the more experienced cross-functional data science teams, including mine, who believe that the leadership's generosity towards the new data scientists is misplaced. They strongly opine, although not openly, that the leadership should not be enamored by flashy yet generic AI-ML slide decks and ""data sciency"" quotes being thrown at them by these new age data scientists.  They feel that these inexperienced data scientists are pursuing impractical ideas that do not contribute to the business effectively. 

Additionally, the new data scientists seem uninterested to take-up any other analytical or engineering work apart from coding in  their Jupyter NBs. While it is important for data scientists to experiment, there needs to be a balance and clarity on when to focus and when to halt. Due to lack of data literacy among the leadership, we feel that there is a lack guidelines to prevent inexperienced data scientists from pursuing use cases that do not provide value to the business.

Has anyone ever been in similar situations? Any suggestions on how we can prevent these?","IMO, a DS is chasing a wild goose if they are solving a problem no one is begging them to solve. Technically, there is no problem fit and there is no willing user. 

The notion that ""let's build the technology, then we find a use case for it"" doesn't work 99% of the time. 

The right thing to do IMO is to search for a problem that solves someone's headache. If your DS spends most of their time searching and formalizing such problems, identifying its stakeholders, collecting relevant data for it, then they are doing invaluable work. Even if they are not the ones who solve it.","\> Some teams in my organization have empowered data scientists to explore and develop AI/ML use cases, which is a positive initiative.

&#x200B;

I don't think this is positive. My understanding of the Data Science work has evolved a lot over the years. Having a team that only does Data Science leads to the approach of - we have a tool (Data Science), how do we use it? That is starting from the solution, as opposed to starting with a business problem. Therefore I am a big proponent of cross-functional teams that can build data products E2E and don't always need Data Science (but it should be an option) in which case the Data Scientist can do research that doesn't block the critical path to a first product. This works as especially the first iterations of tools can often get away without too much complex Data Science and it gives Data Science time to research ahead.",Maybe the leaders are betting on this approach and they feel satisfied with the risk /reward tradeoff.
1707727642.0,112,Sesamestreet teaching kids the importance of metadata,,"It's from this old [Kermit the frog newsreporter](https://www.youtube.com/watch?v=E52o2w5eUvw) gag 😆 ""here are some of the latest scores""",Wow. This is my life in a nutshell.,😂
1705006473.0,110,When all else fails in debugging code… go back to basics,I presented my teams’ code to this guy (my wife’s 2023 Christmas present to me) and solved my teams’ problem that had us dead in the water since before the holiday break. This was Lord Raiduck and I’s first code review workshop session together and I will probably have more in the near future.,Don’t you mean ‘quack’ to basics?,Where do you get cool rubber duckies like this?,"I retired mine to the bathroom.


Now it watches me in utter horror as I float around the tub naked."
1711464600.0,110,What are the software engineering best practices that we should know?,As the title suggests I am looking how to improve my overall code quality by taking from our not so close cousins SWE. Any learning resources would also be greatly appreciated.,Follow arjancodes and mcoding on youtube to learn more about design patterns and anti patterns. Follow PEP 8. Be more conscious about using appropriate data structures. Follow best practices concepts like KISS and unit testing. Reading code from software devs helps a lot to see how they think and structure things. There's no silver bullet. It depends on where you think your shortcomings are,"The three things i would recommend:

1. Write functions and get good at knowing how to improve function abstraction (this takes a lifetime)

2. Use type annotation with Pydantic (or method dispatch if you're an R user)

3. Get in the habit of testing your functions and learn what you need to test and what doesn't need tests (also takes a lifetime)","Off the top of my head:

Abstractions, OOP, proper unit testing, PEP-8, DRY/KISS"
1708464432.0,109,Got data anyst job in my country's top food retailer thanks to Coursera,"My bachelor degree is a compete waste and piece of shit (public administration) , which I realised after a second year. Fortunately, due to the war in my country, coursera gave access to its courses for free. I started by talking courses on statistics in social science from uni of Amsterdam (brilliant specialization), and gradually realised I kinda like data, so took courses in R, Excel and Sql.

And after like a month of job hunt, I got here and tomorrow is my first day at my first job!

  
I am so grateful to Coursera! ",Which courses did you find the most helpful? I am tutoring some people working through the Google Data Analytics coursera and I’d love to hear about some courses they could work on after finishing that.,Wow congrats. Can you talk a bit more about your process. What did you talk about in the interview and how did you structure your CV?,Switched from EE to DS thanks to Udemy. God bless Jose Portilla
1705643210.0,111,What is the most versatile regression method?,"TLDR: I worked as a data scientist a couple of years back, for most things throwing XGBoost at it was a simple and good enough solution. Is that still the case, or have there emerged new methods that are similarly ""universal"" (with a massive asterisk)?

To give background to the question, let's start with me. I am a software/ML engineer in Python, R, and Rust and have some data science experience from a couple of years back. Furthermore, I did my undergrad in Econometrics and a graduate degree in Statistics, so I am very familiar with most concepts. I am currently interviewing to switch jobs and the math round and coding round went really well, now I am invited over for a final ""data challenge"" in which I will have roughly 1h and a synthetic dataset with the goal of achieving some sort of prediction.

&#x200B;

My problem is: I am not fluent in data analysis anymore and have not really kept up with recent advancements. Back when was doing DS work, for most use cases using XGBoost was totally fine and received good enough results. This would have definitely been my go-to choice in 2019 to solve the challenge at hand. My question is: In general, is this still a good strategy, or should I have another go-to model?  


Disclaimer: Yes, I am absolutely, 100% aware that different models and machine learning techniques serve different use cases. I have experience as an MLE, but I am not going to build a custom Net for this task given the small scope. I am just looking for something that should handle most reasonable use cases well enough.

&#x200B;

I appreciate any and all insights as well as general tips. The reason why I believe this question is appropriate, is because I want to start a general discussion about which basic model is best for rather standard predictive tasks (regression and classification).","General Additive Model.  Like OLS, but with non-linear functions.","As my former econometrics professor used to say, it's really hard to beat a good OLS regression.","Depends on the criteria.

In terms of predictive power it is still the case that XGBoost (or LightGBM) can be thrown at most predictive problems and outperform other methods.
It has even become more versatile in its usage in that it is now also often applied to time series.

If you are concerned with interpretability as well as predictive power then OLS , GAM etc would be more versatile.
Using explainable AI such as SHAP, LIME etc is messy, so XGBoost falls short here imo."
