1706201329.0,187,I got rejected by Toward Datascience,"I have worked on several forecasting projects in the past few months, and I decided to write a blog to share my learnings and insights with data analysts and junior data scientists. After writing the blog, I submitted it to TDS. They rejected it, stating that 

    'the overall flow of the post was too disjointed and the approach to the topic was somewhat too high-level and not actionable/concrete enough.' 

I don't blame them for this feedback, and I've done some editing to make the article smoother. Has the article improved? Anything I should add to the article? I hope to turn this around and win back on TDS. Any advise will be helpful.  


I've post it here: [https://acho.io/blogs/why-i-perfer-tree-models](https://acho.io/blogs/why-i-perfer-tree-models)

&#x200B;","Do you have an editor - or someone who can act as an editor? It doesn't need to be someone with technical knowledge, but someone who does a lot of reading? (I use my mom).

(I don't intend to sound harsh here, I'm trying to be supportive).

""Just as weather forecasting is valuable in our daily lives, time-series forecasting plays an important role in business decisions."" Huh? Seems like a different thing, and it's kind of irrelevant. Someone has already decided to read the article, so they think it's worth knowing. You don't need to persuade them.

""Today, massive data is gathered through automations and systems every day, making time-series data increasingly prevalent and accessible.""  I don't know what automatons and systems are. Again, this is known. What about something like ""Organizations collect large amounts of data on a daily basis, which can be mined for insights and information.""

""Consequently, the ability to learn from these time-series data and generate accurate forecasts for the future is becoming ever more essential."" I don't see how that follows (is consequent). It's more essential? Essential is binary - it's essential or it's not. Maybe it's more useful, but why is it more useful than it would have been in the past? Presumably it's equally useful? But now we can do it? 

The article is taking too long to get to the point. 

I encourage you to keep writing. Pretty much the only way to get better at writing is to do more of it. There are lots of ways to practice writing (and perhaps gain a reputation, which might be useful, or you can point people towards).  Blogs, Reddit, CrossValidated, etc can all be good practice and sources of feedback - try writing something wrong on CrossValidated and see what happens. :)","I think you have a bit of mix of styles problem - you start with very trivial stuff that forecasting is important then go to trees and conclude there is a lot more to be taken into consideration.

 If I want trees, I do not want stuff about what is business forecasting, and vice versa.

 You definitely have something to say but it is deeply inside your writing, so the problem is kind of lack of focus - what is the value to the reader, noise/signal ratio in you text. Maybe make it shorter but to the point or split in two pieces.","Don't feel bad. I use to write for TDS (30+ published articles) and the new chief editor is awful (he has no technical background and even worse is very arrogant). That said as others point out your article does have several run-on sentences, is hard to follow at times, and repeats itself. It also has a bit too much business jargon for my liking. If you want to DM me I could give more detailed feedback.

I would honestly avoid publishing to TDS though and I say that as a prior author. They have gone down a road of pure clickbait and seem to now reject higher quality pieces they think might be too technical for their audience. It used to be they would just accept everything but now there is a lot more curation, however it is curation of clickbait."
1708458191.0,170,"""Prepare to be replaced by a data engineer""","I remember a tweet from a ML Head from a company of my country that was along the lines of ""If you are a Data Scientist and if in your daily preparation you dont include business readings then prepare to be replaced by a data engineer"".   What do you think about this statement?",I have no idea what this statement even means tbh,"Not saying data scientist is a higher skilled position than data engineer, but they're two completely different skillsets. Unless you can fully automate the tasks a data scientist does into an API call or a function, I doubt a data engineer would be able to do effective data science work. 

I'm guessing the ML Head has no idea what these two roles are and just think engineers are more practical than scientists. 

Not to question this person's credentials, but there are a lot of higher ups in the data field who shouldn't really be there, and only got there by being lucky, playing politics, and BSing their achievements. Okay maybe I am questioning this person's credentials.","Of course, I agree with others, those two positions are not comparable. But are connected.



What I am seeing in the last two years are more job openings for data engineers and less for data scientists.



One idea is that companies tried with data scientists, concluded that their data is not ready and that they need data engineers before hiring more DSs.



At least that's what I see in my company."
1707028017.0,173,Visualizing What Batch Normalization Is and Its Advantages," Optimizing your neural network training with Batch Normalization 

[Visualizing What Batch Normalization Is and Its Advantages](https://preview.redd.it/dah6fe3kgigc1.png?width=999&format=png&auto=webp&s=a0f8a08ae05cf2989d109ae274b6f65e5cc83002)

# Introduction

 Have you, when conducting deep learning projects, ever encountered a situation where the more layers your neural network has, the slower the training becomes? 

 If your answer is YES, then congratulations, it's time for you to consider using batch normalization now. 

# What is Batch Normalization?

 As the name suggests, batch normalization is a technique where batched training data, after activation in the current layer and before moving to the next layer, is standardized. Here's how it works: 

1. *The entire dataset is randomly divided into N batches without replacement, each with a mini\_batch size, for the training.*
2. *For the i-th batch, standardize the data distribution within the batch using the formula:* *(Xi - Xmean) / Xstd**.*
3. *Scale and shift the standardized data with* *γXi + β* *to allow the neural network to undo the effects of standardization if needed.*

 The steps seem simple, don't they? So, what are the advantages of batch normalization? 

# Advantages of Batch Normalization

### Speeds up model convergence

 Neural networks commonly adjust parameters using gradient descent. If the cost function is smooth and has only one lowest point, the parameters will converge quickly along the gradient. 

 But if there's a significant variance in the data distribution across nodes, the cost function becomes less like a pit bottom and more like a valley, making the convergence of the gradient exceptionally slow. 

 Confused? No worries, let's explain this situation with a visual: 

 First, prepare a virtual dataset with only two features, where the distribution of features is vastly different, along with a target function: 

    rng = np.random.default_rng(42)
    
    A = rng.uniform(1, 10, 100)
    B = rng.uniform(1, 200, 100)
    
    y = 2*A + 3*B + rng.normal(size=100) * 0.1  # with a little bias

 Then, with the help of GPT, we use matplot3d to visualize the gradient descent situation before data standardization: 

[ Visualization of cost functions without standardization of data.  ](https://preview.redd.it/s7zorqm9higc1.png?width=537&format=png&auto=webp&s=f92388f9e3384eee96ce2585b7bc70f25392cee9)

 Notice anything? Because one feature's span is too large, the function's gradient is stretched long in the direction of this feature, creating a valley. 

 Now, for the gradient to reach the bottom of the cost function, it has to go through many more iterations. 

 But what if we standardize the two features first? 

    def normalize(X):
        mean = np.mean(X)
        std = np.std(X)
        return (X - mean)/std
    
    A = normalize(A)
    B = normalize(B)

 Let's look at the cost function after data standardization: 

[ Visualization of standardized cost functions for data. ](https://preview.redd.it/5ou0awyehigc1.png?width=618&format=png&auto=webp&s=72c3f4dd14b78d52f0fe1396a0c131d19e0f6aea)

 Clearly, the function turns into the shape of a bowl. The gradient simply needs to descend along the slope to reach the bottom. Isn't that much faster? 

### Slows down the problem of gradient vanishing

 The graph we just used has already demonstrated this advantage, but let's take a closer look. 

 Remember this function? 

[ Visualization of sigmoid function.  ](https://preview.redd.it/jl3cyhojhigc1.png?width=499&format=png&auto=webp&s=2c2e2047317d99d89b9232b37fa28652eb10f7bd)

 Yes, that's the sigmoid function, which many neural networks use as an activation function. 

 Looking closely at the sigmoid function, we find that the slope is steepest between -2 and 2. 

[ The slope of the sigmoid function is steepest between -2 and 2. ](https://preview.redd.it/j6l02trmhigc1.png?width=499&format=png&auto=webp&s=504efbe5562e9b477a4c48e943011dca7bab5fa7)

 If we reduce the standardized data to a straight line, we'll find that these data are distributed exactly within the steepest slope of the sigmoid. At this point, we can consider the gradient to be descending the fastest. 

[ The normalized data will be distributed in the steepest interval of the sigmoid function. ](https://preview.redd.it/kk0mrflphigc1.png?width=499&format=png&auto=webp&s=43d1dbc9b1a63952a41730146bfd624db97b2b4d)

 However, as the network goes deeper, the activated data will drift layer by layer (Internal Covariate Shift), and a large amount of data will be distributed away from the zero point, where the slope gradually flattens. 

[ The distribution of data is progressively shifted within the neural network. ](https://preview.redd.it/6y088bkthigc1.png?width=499&format=png&auto=webp&s=69ebded75578b8a0daad7874d3803b926db74363)

 At this point, the gradient descent becomes slower and slower, which is why with more neural network layers, the convergence becomes slower. 

 If we standardize the data of the mini\_batch again after each layer's activation, the data for the current layer will return to the steeper slope area, and the problem of gradient vanishing can be greatly alleviated. 

[ The renormalized data return to the region with the steepest slope.  ](https://preview.redd.it/pmkgqpuwhigc1.png?width=499&format=png&auto=webp&s=84ce3916984707d86f314a3dc458f403b0584999)

### Has a regularizing effect

 If we don't batch the training and standardize the entire dataset directly, the data distribution would look like the following: 

[ Distribution after normalizing the entire data set. ](https://preview.redd.it/a0nuru70iigc1.png?width=484&format=png&auto=webp&s=5bd763b5d450599cb6527089e01b0a1735aac4cb)

 However since we divide the data into several batches and standardize the data according to the distribution within each batch, the data distribution will be slightly different. 

[ Distribution of data sets after normalization by batch. ](https://preview.redd.it/of8wlwc2iigc1.png?width=484&format=png&auto=webp&s=16ad7cf81a7c08512399e7681ff3bce8568d11e7)

 You can see that the data distribution has some minor noise, similar to the noise introduced by Dropout, thus providing a certain level of regularization for the neural network. 

## Conclusion

 Batch normalization is a technique that standardizes the data from different batches to accelerate the training of neural networks. It has the following advantages: 

* Speeds up model convergence.
* Slows down the problem of gradient vanishing.
* Has a regularizing effect.

 Have you learned something new? 

 Now it's your turn. What other techniques do you know that optimize neural network performance? Feel free to leave a comment and discuss. 

 This article was originally published on my personal blog [Data Leads Future](https://www.dataleadsfuture.com/visualizing-what-batch-normalization-is-and-its-advantages/). ",Its always the advantages which are being talked about. I think its rathar important to talk about disadvantages and cases where it shouldnt be used.,OP this is really well done and simplifies the concept for me as a beginner to understand too. Thank you! Looking forward to more,What visualization lib is used here ?
1707863937.0,165,Would you agree? Focusing on mastering math is the best RoI for long-term satisfaction,"First of all, this is from the perspective of an analyst who is more on the business side, so let me know if I'm completely stupid.

Why I'm writing this - I think many people underestimate the basic ""boring"" math and they just go right to how neural networks function or how to use logistic regression

Algorithms keep changing, libraries keep changing, domain related knowledge will (partially) change as your economy sector evolves and you'll pick it up as you go anyway...

Even whatever university degree you pick is kind of arbitrary, some of them might make learning math easier for you, but you can always pick it up yourself - even if you study something seemingly unrelated, if you're smart enough for data science you can self-study math

If you're worried about long-term job prospects and satisfaction, it seems to me you should focus on making your main goal to master all possible areas of math. Even the ones directly unrelated to your work. Because data science (and tech in general) is a lifelong study and you will keep having to learn new stuff all the time.

But if you know the fundamental math behind it all, it will make it much easier to learn new algorithms for example. It will also be easier to pick up the logic behind certain principles within your domain, as you'll get better intuition. Part of this should be learning logic (whether you count this as math or philosophy is up to debate).

I am just thinking out loud and kind of looking for confirmation bias, because I've been learning all the juicy ML algorithms and libraries, programming languages etc in the past few years. And I'm thinking I should have just focused on getting better at statistics, probability, combinatorics, discrete math in general... linear algebra... calculus... hell, even if you go all the way back to elementary school or high school, there are surely some topics you forgot and they might be useful to re-learn (like some stuff from geometry that you NEVER used but it could be the missing piece from understanding some stuff you're working on now).

Because all the stuff I learned a few years ago is already obsolete anyway. But math is unchanged for hundreds and thousands of years. And still useful.

So recently I've more shifted to the theoretical side of things. And it's made me happier with problem solving and I have less impostor syndrome. All kinds of different word problems are good practice especially.

tldr: Instead of learning 50 ways to do similar things, learning the underlying math - not superficially, but all the way to the fundamentals, even all the way to elementary school if you forgot something - should be better for long-term.","Best ROI for long-term satisfaction is strengthening your relationships with family, friends, and the local community",">master all possible areas of math  

lol","Math certainly has a pretty good ROI and returns don’t really diminish as you learn more and more. However, after a certain point it’s probably better to focus on applied experience. It can’t hurt to understand these things at a deep level, but none of that matters if you can’t actually finish a project. I’d take someone with mediocre understanding of the algorithms but decent experience over a math wiz without experience."
1711925235.0,160,First job out of undergrad is really boring,"Hey all, im a fresh grad with a background with applied math and econ. I got a job really quickly after graduation as a data analyst at a large bank in my country (anti money laundering & compliance), but the actual responsibility of the role is more like a data entry position with excel. As you can imagine, it’s painfully dull and low paying aside from the advantage of good LSB (9-5). I’ve been working on a way to automate my work with python scripts, but aside from this there is really not much to add to my resume. 

My overall goal is to move to a backoffice positon in risk/investment research unit in my bank where they do something more quantitative like analytics, modelling and statistical analysis. What else could I be doing to get there in the future? 

","This is common. Ten years ago you probably wouldn’t have been hired into a data analytics position until you had 5+ years of business experience under your belt. It’s not really an entry level job. Success in the field usually comes down to deep business knowledge, which takes time to acquire.

The explosion of data science popularity has created a lot of these junior positions that are being filled with maths grads straight out of university. But you don’t know enough about anything to be useful yet, so you will be kept doing fairly menial work until you learn more about the business.

Long term, don’t expect to use a ton of your maths degree. Every grad has one these days and there aren’t enough jobs with really fancy modelling to employ them all. Most of your job will be applying relatively simple models judiciously based on a deep understanding of the business need.",Completely normal.,"I honestly wish my job was boring. 

I dread Sundays because it's reminder that I have to head into another week of constant pings and a plethora of data analyses with everything on fire for no reason other than just because.

I'd switch with you any day. Be happy, and stay boring."
