1709828162.0,376,I need to show how grateful I am to this sub,"Thanks you guys fpr every single book recommendation, for every single career advice.

I took your recommendations seriously, studied the books you told me to study, and studied other videos on my own, learning everything I can learn on my own.

Then I took the advice someone here told is to talk to someone internally in the data science team, turns out, they were impressed by the scope of the projects I worked on for a sales analyst and how I improved everything data-related in the department and the lead told me once I am ready (I still have a probability course to finish and recap hands on ML) and I will be up for a transfer.

I will be a junior DS in 5 or 6 months time after being an analyst for 2 years (I started when I was 20) and it's all you guys, so, thanks. 

Edit: here's everything:

I started when I was 18 years old, in something that I never knew it would be my gate to this job: a sales agent. Been so for a whole year. This gave me a lot of business context, how a manager leads people under him, and how his manager looks at his performance and understood something about the hierarchical behavior of companies. 
Then, I left the job after a year, now it's the pandemic, I spent it leqrning Excel and basic statistics, all on YouTube.

Moving forward to when I was 20, I had no idea a data analyst is even a title, and got a job as an accountant at a small workshop, with college going on, and I was studying business administration and statistics.
The job was never an accountant or have anything to do with accounting, my manager at the time was a very smart guy, working with pen and paper as his ledger, then I introduced Excel, he was all in for it, I started creating tables for our sales and inventory and customers and places we work in.

He started asking questions, you said last month we made 40K, how come we make 45 this month? I started digging into our data unknowingly doing analysis.

His brother was a regular visitor, I learned that he is the head of data at a big startup in our country, saw what I did, kept giving me tasks and I answer with Excel.

Then, he gave me a course that I highly recommend about Excel: power tools in Excel, you can find sources on YouTube for it a lot (power query, power pivot and data modeling). I started applying DAX, and here comes my first book [Dax Guide](https://www.google.com.eg/books/edition/_/dtr8oQEACAAJ?hl=en&sa=X&ved=2ahUKEwiQo4eZ8OKEAxUXgP0HHXfgDTIQ7_IDKAB6BAgPEAM).

Then I started my LinkedIn journey, showing Excel and powerBI dashboards and applying to jobs, in data analysis, really that's all you need, business context, some technical tools to help you dig into the data and answer questions.

Then, I started reading about data science, how statistics is important and how much I liked it in college, here goes the second book, [Naked Statistics](https://www.amazon.com/Naked-Statistics-Stripping-Dread-Data-ebook/dp/B007Q6XLF2).
Here I learned to think with stats a bit.

Then, I found that I lack implementation to a lot of concepts to statistics, people recommended python for me, here there were two sources for me to learn from, YouTube courses got me up and running into how to write simple code in python and understand the syntax.

Later, DataCamp had tracks, I finished the Data Analyst with python and another one data analyst with SQL. This helped me BIG time in knowing where to go next. 

Note: I was doing all of that while working and being in college.

The DataCamp course had great courses about statistics and probability and simulation. While also practicing SQL, I got really good with it.

Now, got a job as a junior sales ops analyst (my role now). I got lucky, working on real problems and practicing what I learn.

Then started moving back to books, but I lacked problem solving mindset, read these books: [Stop Guessing](https://www.amazon.com/Stop-Guessing-Behaviors-Problem-Solvers/dp/162656986X) and[Lean Analytics](https://leananalyticsbook.com/).

This helped me big time understand how my work affects the company. 

Now it's time to show your work to stakeholders, I read this book: [Storytelling with data](https://leananalyticsbook.com/).

It's time to go back to the details of my job, It was all querying on metabase, an open source BI tool.

I was responsible for giving agents retailers to visit, so, Every morning, we are supposed to apply filters on our data (last order date, last visit date and some other features ) and tell the agent, visit 20 of those retailers and go home. I was doing all of that in an automated fashion with power query, creating automated pipelines was my passion in Excel. All I had to do was give it an updated file from our database, refresh the pipeline, take the new file, dump it into our system.

They do visit 20 retailers, but the problem reached the tech team, the data was too much to handle, requiring us to give a smaller set of retailers for the agents, specifically 40 retailers.

But how do we guarantee they are close to each other? Here come my first interaction with adata scientist.

I did all what I did in Excel but in python using pandas and then reached the point where I don't know how to give clusters.

He took my jupyter notebook, gave it to us back with the solution to our problem, with something I was not familiar with at the time, Kmeans constrained.
Which took only longitude, latitude gave each agent his route of 40 retailers.

I started taking notes from his improvements to my code and asked him, what did you do?

He told my my code was fine, but you used a lot of custom functions on operations that can be vectorized, I asked for a book recommendation about vectorized operations in pandas here, the guys recommended this [Data Wrangling in python book](https://www.amazon.com/Data-Wrangling-Python-Tools-Easier/dp/1491948817).

After that book, I was obsessed with data automation in python using pandas and numpy only.

I got also obsessed with vectorizing any operation in our code base, read something pandas specific now: [Effective Pandas](https://www.amazon.com/Effective-Pandas-Patterns-Manipulation-Treading/dp/B09MYXXSFM).

Then, it was the part where he interacted with our system API.

Since all our company data scientists and swes have access to snowflake and live databases, we, analysts, had access to only metabase.

I saw this as an opportunity to get known!

I wrote two functions used by our entire company, ret_metabase and interact_with_google_sheets
The first one connects to the API endpoint and then takes your credintials and the makes a session ID and gets your card ID string response in json and I convert it to a dataframe. The second requires an Api key, thenenables tge user to do anything with a google sheet, remove data set with a dataframe get data asa dataframe append on data filter views really anything in one function.
How did I learn to do all of that? A course on youtube , just type API development in python amd a book about data structures, [Grokking Algorithms](https://www.amazon.com/Effective-Pandas-Patterns-Manipulation-Treading/dp/B09MYXXSFM). This helped big time in optimizing my code performance and writing cleaner code.

I got known and these functions are in the companies library now and people use it all the time. And I even left funny comments in the documentation and Everything.

The kmeans thing got me really interested in machine learning and here's the first book you guys recommended: [ISLR](https://www.statlearning.com/).

It was really hard for me at first because I had not been introduced properly to those three topics:
1- linear algebra
2- calculus
3- probability and statistics
I took [Jon Krohn's live lessions](https://github.com/jonkrohn/ML-foundations) it's free on YouTube.

But those three were later taken (started linear algebra in November 23).

So I struggled back then and here, another book was suggested: Hands-on ML.

I finished it and was really fucking hyped to apply the stuff I learned directly into my job, even without my manager permissions.

But that was not enough, I did not know what I should do to impact our compqny, what is data science?

I read this book: [Data science with business, what you need to know about DS](https://www.amazon.com/Data-Science-Business-Data-Analytic-Thinking/dp/1449361323)

First thing I dod after understanding what kmeans is, improved our routes clustering function by standerdizing the scales of the long, lat, giving it another column ( retailer rank) that rankstarts at the maximum value the longitude and decays linearly from 31 to 30 (longitude here is from 30 to 31), I used linspace and select in numpy here to give retailers ranks. This rank was business objective (give 31 toretailers with high conversion and then 30.9 to retailers with monotonically decreasing nmv to make them order back and so on...) Any other retailer takes a zero in his face. This helped in giving optimized distance to retailers we really need to visit.

This gave us a big boost in agents strike rate and overall performance.

Second, I applied xgboost, predicting who will place an order today if visited. Gave them the biggest rank.

Testing this was a must, so I learned about A/B testing, and some other great bootstrapping ideas here [Practical Statistics](https://www.oreilly.com/library/view/practical-statistics-for/9781491952955/) Book.

This pushed our strike rate from 40 to 73%.

Then, I really now see that I lack probability knowledge and maths knowledge to be a data scientist, so I read [Essential maths for DS](https://www.amazon.eg/-/en/Essential-Math-Data-Science-Fundamental/dp/1098102932).

Since my job was about sales operations, it was a necessary thing to automate discovering new sales areas and opportunity, previously, we used to draw polygons in areas we want to open, and then the agents are set there to wander and find retailers on their own.

I got an idea, how about I get all streets know in this area and make blocks in the intersections and then convert the coords to google maps link and give 50 daily sequential links to agents to discover areas in a more naturally sequential way? I used omnix API to get streets data and geopandas to make all other operations, I learned how to work with geopandas from their docs, really straightforward.

This project was big, applied everything I know about pandas and data structures and business knowledge to do it, and it's up and running now.

I got praised for it and the head of data was impressed with the result and decided to give me access to snowflake directly to limit requests on metabase as the data was big and then I scaled the project to all regions we operate in.

Then it was time to speak with the senior ds lead.

I showed him all I wrote here, he recommended I get a strong foundation in linear algebra and calculus and probability.

I got it, and now working on probability and statistics.

I then told him I am really into causal inference (rwcommended by someone in my previous post here) and regression analysis.

He said that's exactly what they need from the junior they want to hire, ""anyone can fit and predict nowdays"" he said, ""we need someone who can make an impact in all the stuff we don't have time for and teach him more cloud tools and maybe he gives us new ideas or show us new tools"" he elaborated.

Right now I am studying probability and statistics and then will study [Causal Inference](https://www.oreilly.com/library/view/causal-inference-in/9781098140243/).


I guess that's all, the most important thing is that you keep studying and never giving up, please, focus more on business context as it's overlooked.

I hope this was useful to you guys.","😊Congrats! The summit of one mountain is the base of another, stay hard! ","Congrats! Could you share a summary of the books, resources, advice you found most helpful?","Okay okay spill the beans. We need a detailed roundup. What books and advice? 

And yes, love this sub!!"
1711634474.0,357,What is a Lead Junior Data Analyst?,,The blind leading the blind,You will have the responsibilities of a lead data scientist but you will be paid as a junior 😊,You can do easy projects on your own?
1704756059.0,328,Pre screening assessments are getting insane,"I am a data scientist in industry. I applied for a job of data scientist. 

I heard back regarding an assessment which is a word document from an executive assistant. The task is to automate anaysis for bullet masking cartilages. They ask to build an algorithm and share the package to them.

No data was provided, just 1 image as an example with little  explanation . They expect a full on model/solution to be developed in 2 weeks. 

Since when is this bullshit real, how is a data scientist expected to get the bullet cartilages of a 9mm handgun with processing and build an algorithm and deploy it in a package in the span of two weeks for a Job PRE-SCREENING.

Never in my life saw any pre screening this tough. This is a flat out project to do on the job.


Edit: i saw a lot of the comments from the people in the community. Thank you so much for sharing your stories. I am glad that I am not the only one that feels this way. 

Update: the company expects candidates to find google images for them mind it, do the forensic analysis and then train a model for them. Everything is to be handed to them as a package. Its even more grunt work where people basically collect data for them and build models. 

Update2: the hiring manager responds with saying this is a very basic straightforward task. Thats what the job does on a daily basis and is one of the easiest things a data scientist can do. Despite the overwhelming complexity and how tedious it is to manually do the thing. 
","My general thought, F that! I'm not doing that much for a chance to interview. 

I'm not saying this is what is happening; but some of these seem to be projects that they use as a pre-screening rather than pay for someone to do.

If you want me to do 30 minutes to display basic competency (i.e. eda, elt, basic ML interpretation) that's fine. Anything more and you can kiss my @ss. 

That's just my opinion though.",Free work maybe?,"Well as a SWE that moved into data analysis, this doesn't sound too far off from some interview tasks I have seen. I feel you completely. Its a completely unrealistic for someone working a full time job to perform these types of tasks in an interview.

And all honesty, any job I have applied for with this much work required is simple for me. Do what I can in a hour or two, and then note: I am a working professional and I do not have the time to commit to providing a complete work. I hope that my efforts here have provided insight into how I approach my work. I would love to meet to further discuss the work I have done here.

edit: additionally most of these jobs turned out to not be very worth it. So keep that in mind for how long you spend working."
1709143873.0,316,"If you are an X Analyst, what is your salary?","If you are an X Analyst, what is your salary?

Curious as to what the market looks like right now. Glassdoor, Indeed, Payscale and Salary.com all have a degree of variance, and it also depends on what *kind* of analyst you are.

I am:

-Risk Analyst L1, Financial Services industry

-Coming up to 2 YoE

-Total current comp $66,500 a year

-MCoL city, USA


Personally, very curious to hear from any Data, Risk and Credit Risk analysts out there!","Here is my history:

Data Analyst @ a university, 0 YOE, $40k

Marketing Analyst @ Fintech, 2 YOE, $90k. Laid off 

Data Analyst contract @ Google, 3 YOE, $152k. Made it the full 12 months.

Data Scientist contract @ Snap, 4 YOE, $156k. 5 months in

WTB FTE again 🫠","Risk Analytics Associate (senior analyst essentially)
- 5 YOE, 3 as data analyst , 1 as business analyst 
- 165k USD + 100k USD pre ipo (series D)  options 
- remote in Canada but pay in USD","Risk Data Analyst/Scientist 110k. About to hit 3 YOE

Electrical Engineering degree"
1707502557.0,313,Data science interviews are giant slogs still I see,"My department is cutting spend, so I decided to venture out and do some DS interviews and man I forgot how much trivia there is.

Like I have been doing this niche job within the DS world (causal inference in the financial space) for 5 years now, and quite successfully I might add. Why do I need to be able to identify a quadratic trend or explain the three gradient descent algorithims ad nauseum? Will I ever need to pull out probability and machine learning vocabulary to do my job? I’ve been doing this (Causal Inference) work for which I’m interviewing for years, and these questions are not exemplary of this kind of work.

It’s just not reflective of the real world. We have copilot, ChatGPT, and google to work with everyday. Just man, not looking forward to re-reading all my grad school statistics and algerbra notes in prep for these over the top interviews.","The slog I found were the coding test, where a full day or twos worth of work was asked for. An instant no in response to that ","All the gotcha questions to see if you also just read the same passage the interviewer did from ""Hands-on Machine Learning with scikit-learn and Tensorflow"" are a complete waste of time and indicate that at least the interviewer and probably the whole organization are immature in their approach to DS. 
The only good way to conduct technical interviews that I have experienced is to present the interviewer with a dataset/problem-set and have them try to approach it in their own way. Then ask them why they did it the way they did it without looking for an exact vocab word.
I don't have to remember the word ""heteroskedacticity"" to notice it and talk coherently about how to handle it.",[deleted]
1706457085.0,298,"UPDATE #2: I built an app to make my job search a little more sane, and I thought others might like it too! No ads, no recruiter spam, etc.","Hey again everyone!

&#x200B;

We've made a lot of progress on [zen](https://zensearch.jobs/) in the past few months, so I'll drop a couple of the most important things / highlights about the app here:

* Zen is still a candidate / seeker-first job board. This means we have no ads, we have no promoted jobs from companies who are paying us, we have no recruiters, etc. The whole point of Zen is to help you find jobs quickly at companies you're interested in without any headaches.
* On that point, we'll send you emails notifying you when companies you care about post new jobs that match your preferences, so you don't need to continuously check their job boards.

&#x200B;

In the past few months, we've made some major changes! Many of them are [discussed in the changelog](https://zensearch.jobs/changelog):

1. [We now have a much more feature-complete way of matching you to relevant jobs](https://zensearch.jobs/jobs)
2. We've collected a ton of new jobs and companies, so we now have \~2,700 companies in our database and almost 100k open jobs!
3. We've overhauled the UX to make it less noisy and easier for you to find jobs you care about.
4. We also added [a feedback page](https://zensearch.jobs/feedback) to let you submit feedback about the app to us!

&#x200B;

I started building Zen when I was on the job hunt and realized it was harder than it should've been to just get notifications when a company I was interested in posted a job that was relevant to me. And we hope that this goal -- to cut out all the noise and make it easier for you to find great matches -- is valuable for everyone here :)  


Here are the original posts:   


* [https://www.reddit.com/r/datascience/comments/183562x/update\_i\_built\_an\_app\_to\_make\_my\_job\_search\_a/](https://www.reddit.com/r/datascience/comments/183562x/update_i_built_an_app_to_make_my_job_search_a/)
* [https://www.reddit.com/r/datascience/comments/17s5fyq/i\_built\_an\_app\_to\_make\_my\_job\_search\_a\_little/](https://www.reddit.com/r/datascience/comments/17s5fyq/i_built_an_app_to_make_my_job_search_a_little/)

&#x200B;

[And here's one more link to the app](https://zensearch.jobs)","Wow thank you!

Also, what’s the catch? ","Hi! Cool project, and a nice goal! It's exciting to see someone being able to ramp up a company/job database quickly!

Not so long ago, I used to work on Search/Matching/Relevance in one of the largest job search websites in the world. I could probably help with some discussions/ideas, feel free to reach out!",How do you get the jobs data? Scraping or APis?
