Date,Post score,Post title,Body of the post,Top comment 1,Top comment 2,Top comment 3
1706704645.0,1707,Friendly reminder not to work too hard. You'll just get fired,"The year just started and there are already over 50K layoffs. The latest one is UPS, including some data professionals at corporate. These are people who worked hard, built a career with the company over extremely long period of time, stayed loyal, 3% merit increases, worked extra hours because they believed that they were contributing to a better future for the company and themselves.... And they were laid off without a second thought for cost saving. Yeah, Because that makes so much sense, right? Record-breaking profits every year is an unattainable goal, and it's stupid that here in the USA, we are one of the only countries that keeps pushing for this while other countries are leaving us in the dust with their quality of life....


So just remember. If you're thinking about doing some overtime for free, or going above and beyond just for a pat on the back, don't do it. You only have so many years on Earth. Focus on your own life and prioritize yourself, always","I'm in HR Workforce management,

Let me tell you, C-Suite usually only ask for Salaries by job profiles. That's it. No engagement scores, performance metrics, Management reviews. Nada. They rarely dig into the specifics of who you are as a person, rather the role you play in the company and what roles are ""expendable"".

It blows my mind how unscientific and how broad the brushstrokes are when they layoff people. It's literally the most awkward and clunky way to save money. It's as if Finance went through a car and started tearing up things they don't need with 0 knowledge of how a car actually works. For the most part they will 100% save money, but in the long term, that car will fall apart and the remaining pieces are overworked and fail sooner. Taking off hubcaps, spare tires, air caps....","I agree. I'm going through something similar as well. Worked my ass off to help build a company since 2019, and then throughout the pandemic, for that company to just say that my performance is poor last year and they are unable to give me any promotion or increment.

Then, they switched my job scope to something outside of my role (I know, this is a way for them to ""fire"" me without firing me). And I couldn't take it, so I decided to quit, and the company was happy to sign me off.

5 years of hard work, day and night, and on weekends too (especially during the pandemic when everyone was stuck inside) and it all summed up to them quietly kicking me out.","I lost my job three times in a row, so I think loyalty is overrated."
1709037427.0,1387,Data scientist quits her job at Spotify,In summary and basically talks about how she was managing a high priority product at Spotify after 3 years at Spotify. She was the ONLY DATA SCIENTIST working on this project and with pushy stakeholders she was working 14-15 hour days. Frankly this would piss me the fuck off. How the hell does some shit like this even happen? How common is this? For a place like Spotify it sounds quite shocking. How do you manage a “pushy” stakeholder?,You can’t manage a pushy stakeholder unless your boss supports you.,"> How do you manage a “pushy” stakeholder?

I'm a SWE, not a data scientist, but my answer for a case like this is quite simple.

Me: ""I'm struggling to meet the demands here. My understanding is that this is a very important and high priority initiative, is that right?""

Stakeholder: ""Yes, it's very high priority and urgent.""

Me: ""So why am I the only person who's working on it? Can we get more resources?""

Then the stakeholder is forced to either backtrack and admit that the urgency and priority isn't as high as they're making it out to be, or else is forced up the chain of command to provide additional resources.

If this seems confrontational, _it is_. If you work at a place where you feel afraid to have a direct conversation like this, you need to get out regardless.","This is not uncommon, especially for data scientists embedded into non-data teams as she was. Ultimately, stakeholders dont understand the time silent work takes (interpreting requirements, sourcing or even extracting data, due dilligence in data interpretation, data processing, storytelling, generating visualizations) as its outside their domain and have their own prios/deadlines to worry about. Tbf, I’m a DS and cant even properly estimate how long a request will take unless using data I produced or am super familiar with.         

Add on top, managing changing requirements and the enormous level of context switching between trying to do deep work and sporading meetings in all levels of the org (your immediate stakeholders, your team, company-wide, etc) and Slack messages. So, data scientists are asked for work beyond the time or mental bandwidth they have.         

The DS role can be VERY ambiguous and unstructured (even in good companies like Spotify), stories like this are the unfortunate consequence. I’m personally preparing myself to transition to slightly more structured job types within tech because each of my DS roles is completely different from the next, including in the tasks I do or the knowledge I’m expected to have."
1708323275.0,1056,The BS they tell about Data Science…,"1. In what world does a Director of DS only make $200k, and the VP of Anything only make $210k???

2. In what world does the compensation increase become smaller, the higher the promotion? 

3. They present it as if this is completely achievable just by “following the path”, while in reality it takes a lot of luck and politics to become anything higher than a DS manager, and it happens very rarely. ",Wait... who's paying Analysts 90k🧐,The real bs is we can start right here lol,Meanwhile to anyone outside of the US these salaries are absolutely insane. Glassdoor says the average DS in the UK makes £52k which is around $65k.
1709658865.0,888,Everything I've been doing is suddenly considered AI now,"Anyone else experience this where your company, PR, website, marketing, now says their analytics and DS offerings are all AI or AI driven now?

All of a sudden, all these Machine Learning methods such as OLS regression (or associated regression techniques), Logistic Regression, Neural Nets, Decision Trees, etc...All the stuff that's been around for decades underpinning these projects and/or front end solutions are now considered AI by senior management and the people who sell/buy them. I realize it's on larger datasets, more data, more server power etc, now, but still.

Personally I don't care whether it's called AI one way or another, and to me it's all technically intelligence which is artificial (so is a basic calculator in my view); I just find it funny that everything is AI now.",Ride the wave 🌊 just make sure to have savings when it crashes,"IMO, the greatest achievement of AI is companies convincing others that everything is the product of AI.","10+ years ago it was all ""Big Data"".

Most of it still is.

And much it was also AI at the time.  The technical definition of AI is pretty broad."
1710119472.0,798,Turns out my best data science work is helping Redditors get jobs...,,I’ve mentored a few friends into getting better jobs and careers than myself. They were starting at nothing. Somehow I can’t figure out how to do this for myself.,Are you looking to help more people lol?,What would be your advice for a new grad seeking roles in the market?
1710926800.0,782,A data scientist got caught lying about their project work and past experience during interview today,"I was part of an interview panel for a staff data science role. The candidate had written a really impressive resume with lots of domain specific project work experience about creating and deploying cutting-edge ML products. They had even mentioned the ROI in millions of dollars. The candidate started talking endlessly about the ML models they had built, the cloud platforms they'd used to deploy, etc. But then, when other panelists dug in, the candidate could not answer some domain specific questions they had claimed extensive experience for. So it was just like any other interview.

One panelist wasn't convinced by the resume though. Turns out this panelist had been a consultant at the company where the candidate had worked previously, and had many acquaintances from there on LinkedIn as well. She texted one of them asking if the claims the candidate was making were true. According to this acquaintance, the candidate was not even part of the projects they'd mentioned on the resume, and the ROI numbers were all made up. Turns out the project team had once given a demo to the candidate's team on how to use their ML product.

When the panelist shared this information with others on the panel, the candidate was rejected and a feedback was sent to the HR saying the candidate had faked their work experience.

This isn't the first time I've come across people ""plagiarizing"" (for the lack of a better word) others' project works as their's during interview and in resumes. But this incident was wild. But do you think a deserving and more eligible candidate misses an opportunity everytime a fake resume lands at your desk? Should HR do a better job filtering resumes?

Edit 1: Some have asked if she knew the whole company. Obviously not, even though its not a big company. But the person she connected with knew about the project the candidate had mentioned in the resume. All she asked was whether the candidate was related to the project or not. Also, the candidate had already resigned from the company, signed NOC for background checks, and was a immediate joiner, which is one of the reasons why they were shortlisted by the HR. 

Edit 2: My field of work requires good amount of domain knowledge, at least at the Staff/Senior role, who're supposed to lead a team. It's still a gamble nevertheless, irrespective of who is hired, and most hiring managers know it pretty well. They just like to derisk as much as they can so that the team does not suffer. As I said the candidate's interview was just like any other interview except for the fact that they got caught. Had they not gone overboard with exxagerating their  experience, the situation would be much different.","We hired a junior Analyst who leaned into data science at a Fortune 100 company. Incredibly bright but couldn't stick with an idea long enough to produce work product so we were starting a pip when they quit. 

Three years later, they are a VP at a Fortune 10. I've been sent their resume by a few colleagues who had him in their hiring pools for feedback. There isn't an ounce of truth from our time together. It lists management of teams that didn't exist, projects the individual never worked on, experience the person never demonstrated etc.

Yet it worked. This person had three jobs before getting the VP role but seems to be doing well for themselves.

It's why both technical and behavioral interviews are important.","I’ve been in IT/data for 25+ years. From my anecdotal experience, your case is the norm and not an outlier. It’s human nature. 

It’s why we have phone interviews and in-person interviews. 

p.s. ROI numbers on resumes are the stupidest thing to happen in the last ten years.","I mean to be fair, many companies are also blatantly lying about their work culture, workload and other important facts. I guess it's all about navigating through the bullshit and lies in a interview process, which goes both ways. I always try to stay suspicious as a interviewer aswell as an interviewee."
1706085085.0,681,"Is it just me, or is matplotlib just a garbage fucking library?","With how amazing the python ecosystem is and how deeply integrated libraries are to everyday tasks, it always surprises me that the “main” plotting library in python is just so so bad.

A lot of it is just confusing and doesn’t make sense, if you want to have anything other than the most basic chart.

Not only that, the documentation is atrocious too. There are large learning curve for the library and an equally large learning curve for the documentation itself

I would’ve hoped that someone can come up with something better (seaborn is only marginally better imo), but I guess this is what we’re stuck with","We rarely use matplotlib directly. If you use a library which uses matplotlib as a backend, then of course you have to deal with it a bit; but otherwise I strongly suggest to use plotly instead for your own visualizations.","If memory serves, matplotlib was essentially copied from the equivalent Matlab library because that was the most popular option at the time. They implemented a lot of things in the ""Matlab way"" to minimized transition costs which makes the interface awkward and non-Pythonic.

It's an old library that has a lot of momentum and a lot of legacy users. But you don't have to use it. Most people I know have long switched to other options. It's slowly fading away as the more modern libraries take over.","Yup, I agree. You can create amazing plots with matplotlib, but it's not going to be a fun experience. Plotly is better, seaborn also helps but is still dependent on matplotlib for many things.

I'm a Python guy, but ggplot2 is absolutely so much better to work with than any python plotting library."
1711097326.0,676,"DS Salary is mainly determined by geography, not your skill level","I have built a model that predicts the salary of Data Scientists / ML Engineers based on 23,997 responses and 294 questions from a 2022 Kaggle Machine Learning & Data Science Survey.

Below are the feature importances from LGBM.

TL;DR: Country of residence is **an order of magnitude** more important than anything else (including your experience, job title or the industry you work in).

Source: [https://jobs-in-data.com/salary/data-scientist-salary](https://jobs-in-data.com/salary/data-scientist-salary)



https://preview.redd.it/b89q4likmupc1.png?width=1200&format=png&auto=webp&s=3e989d7cb71601e45cd3bea86802c0a8294e9e9d","Well, yeah.

If a job exists in a country it tends to pay relative to the cost of living in that country, or at least relative to how much other jobs in that country pay.

Also, no. You generally can't just work remotely for a US company and get the geographic pay difference. They'll want to pay you based on where they owe taxes on your income.","This applies to every job so it isn't a surprise. An accountant in the US will usually earn more than the same profession in Nigeria (to pick a random place). Also most people can't easily move countries. You might as well remove geography from the data, and maybe we get something more insightful out of this.","That's true for every job because cost of living and economic strength of a country determine average salary level.

So what's the feature importance if we account for that and which countries do pay less/more for DS relative to their median salary?"
1708005545.0,642,A harsh truth about data science....,"Broadly speaking, the job of a data scientist is to use data to understand things, create value, and inform business decisions. It it *not necessarily* to implement and utilize advanced Machine Learning and Artificial Intelligence techniques. That's not to say that you can't or won't use ML/AI to inform business decisions, what I'm saying is that it's not always required to. Obviously this is going to depend on your company, their products, and role, but let's talk about a quintessential DS position at a quintessential company.

I think the problem a lot of newer or prospective Data Scientists run into is that they learn all these advanced techniques and want to start using them right away. They apply them anywhere they can, kind of shoehorning them in and not having a clear idea of what it is they are even trying to accomplish in the first place. In other words, the tools lead the problem. Of course, the way it should be is that the problem leads the tools. I'm coming to find for like 50+% of the things I'm asked to do, a time series visualization, contingency tables, and histograms are sufficient to answer the question to the satisfaction of the business leaders. That's it. We're done, on to the next one. Start simple, if the simple techniques don't answer the question, then move on to the more advanced stuff. I speak from experience, of course.

In my opinion, understanding when to use simple tools vs when to break out the big guns is way harder then figuring out how to use the big guns. Even harder still is taking your findings and translating them into actual, actionable insights that a business can use. Okay, so you built a multi-layer CNN that models customer behavior? That's great, but what does the business do with it? For example, can you use it to identify customers who might buy more product with more advertising? Can you put a list of those customers on the CEO's desk? Could a simple regression model have done the same in 1/4 of the time? These are skills that take years to learn and so it's totally understandable for newer or prospective DSs to not have them. But they do not seem to be emphasized in a lot of degree programs or MOOCs. It seems to me like they just hand you a dataset and tell you what to do with it. It's great that you can use the tools they tell you to on it, but you're missing out on the identifying which tools to even use part in the first place.

Just my 2c. 

&#x200B;",I also think a huge factor is that companies ask for AI and ML solutions because it's what they hear about and what they can brag about. That then pushes DS to use tools they don't need to. ,"Can't we just acknowledge that knowing to write code, understand statistics, and also domain expertise, are difficult skills to master, even if you don't need to invent novel algorithms?
The fact that the job is not ultra complicated is making PhDs who are used to get paid pennies for ultra difficult tasks perplexed.

Anyway, I am asked to develop novel models and honestly sick of the pressure and uncertainty a little.","The harsh truth is that it wasn’t always like that… Here is a brief history of the data science title and how it shifted. TLDR at the bottom. 

What is the difference between a data scientist today and a statistical analyst of yesterday? Not much, maybe data scientists use python now and Jupyter notebooks instead of R and markdown files. But the original vision for the data scientist as described by Harvard’s infamous article describing data science as the sexiest job was not just a rebranding of a statistical analyst. 

Data science made its debut in product. The product was always the algorithm that helped automate decision making. Recommender systems, translation, most recently chat bots. These are the things that originally got us excited about data science when we were laymen. Even in the infamous article “Data Scientist: the Sexiest Job if the 21st Century,” they primarily use the Linkedin recommender system as the tool that revolutionized the business. A product - not a report, not a stakeholder meeting, etc. 

When the decision scientist title existed, data science was still about predictive analytics. Decision scientists have effectively been swallowed by the data science brand as expectations of what data scientists should do shifted. This impacted the field turning data science into a primarily product geared position, to more of a consultant. This is what caused the huge expectation for data scientists to revolutionize business by looking at the data and uncovering hidden trends that would give business x a huge competitive advantage and blow the rest of the competition in the dust. That’s why companies use to be willing to pay so much money for a data scientist. We all know, for the vast majority of companies… it didn’t work out that way. 

Before the ML Engineer title existed, data scientists were the ML guys. ML use to be the very core of data science and what differentiated them from traditional analysts. It was forward looking more than backward looking. Facebooks data science ‘core’ team use to require research degrees in CS and/or Statistics to be in this core team. Other companies were less restrictive, but their core data scientists also researched and applied machine learning methodologies. It wasn’t until Lyft entered the business that core data scientists began rebranding themselves as machine learning engineers and data science became more focused on analysis than product.

In 2018 Lyft singlehandedly changed the data science landscape. One if Lyfts core problems when hiring analytical staff was that due to the insane hype around data science, everyone was calling themselves a data scientist whether or not they had the skills to understand and apply machine learning. Lyft noticed that when they rebranded their unpopular BI roles as data scientists, these class of people that knew nothing about predictive analysis but called themselves data scientists would apply for these roles at mass. (They got paid more too given the new title) And those were exactly the type of people that Lyft needed. You know excel and can make some visualizations on tableau? Great welcome to the data science team. Now the data science umbrella composed mainly of BI analysts, data analysts, core data scientists, and everything in between. I believe at this time the Chief Data Scientist of some tech company infamously changed his instagram handle to read ‘Machine Learning Engineer’ to differentiate himself from the new trend of what data science was becoming. 

How did this happen? Well, we’ve all been there or heard this story. You get onboarded as a data scientist at a company, the CEO has created a whole data science team, everyone can make a dashboard, everyone knows excel. There is no data engineering team, no product, no path forward. That is why the CEO hired so many data scientists anyway, to uncover his businesses future. Next month, and hundreds of thousands of dollars later the entire team is gutted, the CEO is fired, and the company is restarting their data practice from the bottom up starting with data engineers and software engineers. Can’t code? You’re not in. Can’t build products you’re not in. You’re on the data science team? Great, how are those KPIs looking this month? Expectations of what data science was supposed to be were way too high. Data Scientists were expected to be business magicians and lead companies next to business leaders. Some did, most didn’t. Now people have a more realistic perspective for the data science role as a non revolutionary analyst type role.

Who’s to blame and what’s the lesson? 
No one’s to blame, this is the hype cycle that has existed with every new thing in business. There’s a whole ‘Gen AI’ hype right now where everyone thinks AI is a chatbot. Maybe this is a cautionary tale to business leaders and aspiring data professionals to dig deeper beyond the hype so you’re not left disillusioned. 

TL:DR;
Data science teams were mainly product focused machine learning teams until Lyft changed the landscape and rebranded their BI Analysts as Data Scientists. This rebranding was good for Lyft, but left many smaller companies disillusioned with Data Scientists as they began hiring BI Analyst types with the expectations that data science will revolutionize their company to become industry leaders. Those who pioneered advancements in machine learning under the data scientist title have rebranded themselves as machine learning engineers to differentiate themselves. Now the data science role is a non extraordinary analyst type role. Be careful around hype cycles so you too are not left disillusioned."
